ratings,review_titles,reviews
5.0,"""Overall a good washing machine""","I have owned & used this machine over a year now. I don't trust reviews written by those who have owned a product for only a short time, especially one that takes time to learn and for faults to show, like a washing machine! Please, don't write a reviews until you have really had a chance to use a product and wait until the ""glow"" (or a bad initial experience) wears off.  With that said, overall this has been a very good washing machine. There are tons of features and I have used most. This should please almost anyone. Modest price, but features that are on more expensive units. The capacity is great. The controls are easy to figure out. We have allergy issues so the ""allergen"" cycle is great for that A few reviewers have complained about a ""smell""...I always leave the door open at least an hour or two after a wash load is emptied. When I do that, I have no issue. There is a drum cleaning cycle and used it once. But I have found there is little odor if I air it out. The drum itself is still spotless today! For the most part, I use detergent paks, and have no issues with clothes not coming out fresh and clean. I have found the liquid fabric softener dish seems to clog, but I rarely use that, and the detergent dish has no clogging problem when I have used it.. The machine is quiet and I have seen NO EVIDENCE that the labels wear out or come off!  The built quality seems good, and have had no external wear at all..still looks new. And I downloaded the ""app"" which diagnoses problem codes: never used it, so deleted it! I have NEVER had a load stop, become un-balanced or not finish for any reason! That was one of the biggest complaints I read about regarding HE Washers in general, but I have had absolutely NO ISSUES like that, with this machine. The only ""con"" I can think of, is the height of the machine. As a 6'3"" person, it can be a challenge to get the laundry out of this front loading machine. I did not purchase a stand, and if I had, that would have taken care of that!"
5.0,"""Great Appliance!""","Beautiful color. Runs so so quiet. Nice ring tones as alerts on machine. Has Steam feature that connects with dryer. The price is very competitive now as apposed to years ago for this machine. Comes with a 10 year manufacture warranty on the drive belt which says to me that the manufacturer has confidence in their appliance. Also purchased the matching dryer and is super quiet as well. Both drums hold a ton of clothing, towels, etc."
2.0,"""lasted 3 years""","Overall this is a nice washer machine with great features and smooth running. Unfortunately it is also poorly built. On the third year the spinning cycle started getting louder and louder and the whole thing would shake violently. Had a Sear tech coming to check it and dropped the bomb. The main chamber bearing is worn off and needs to be changed. I am talking about standard use, a 3 adult household using the machine 2 times a week in average.Just getting a new bearing will cost $750, bought directly form Samsung, labor will bring the total to $930. So, now we are just waiting for the washer to die and preparing to get a new one. My first and last Samsung appliance, in fact my last Samsung anything."
5.0,"""The BEST washer and dryer ever built""","I purchased a new style LG because it liiked really impressive, after two replacements, we went back to what we knew. This is their new style Samsung and it is the best washer and dryer that I have ever had. My wife loves this washer, and it is fast and efficient. It outperforms the other Samsung unit that we had, which suprised me, because it worked really well. I assure you you will be ultimately impressed with this unit along with its steam dryer partner."
5.0,"""I love em'""","I love this washer. The only thing I don't like is the smell, but it is fading. I love the chirping noise it makes. I love all the various settings. This washer has a huge capacity. I would buy this one again!! It washes very well and clothes come out smelling great. I would not pay full price for it, but I got it on a great sale and it was well worth it."
4.0,"""Nice Machine for the Price""","This review is for the WF42H5200AF 4.2-cu ft High-Efficiency Front-Load Washer with Steam Cycle (Merlot). To begin with, I want to explain to potential buyers of this machine about the negative reviews. When I first set up the washer, I thought I had everything leveled just right. The problem was, I set the level in the center on top of the machine from front to back and in the center from left to right. (It showed a true level) I did the test cycle and I thought the machine was going to go flying apart. I then leveled the machine by putting the level on all four sides, on top of course which was rear, left to right, front, left to right, and both sides front to back. After everything was leveled in this manner, I washed my first load, only taking up half of the washing machines capacity.Sure, there is only a few thumps now for the first few seconds of a rinse or spin cycle. This is normal. I have 3 friends who own frontloads. A Samsung like mine (Which why I bought mine, and I did not ask my friend about how he set his up, whish I did), a Whirlpool and an LG. They all make this little thump when going to spin or rinse.As far as the detergent tray, people are saying that they are experiencing excessive water trapped in there. Well, after my wash is done, I barely have a tablespoon of water thats left behind, regardless if i use Tide Pods directly in the machine or Tide Liquid in the tray. I am thinking those who are complaining about that, their machines are leaning down hill so to speak.Another issue I see is people wondering/complaining why they do not see much water in the machine while washing. For one, the water is in between the stainless tub and a plastic outer tub. If you look closely at the agitators, there are small holes that releases the water while in the wash/rinse mode.Now for the quality. The quality is great, except for the control panel. It is plastic of course. The red color does not match the rest of the machine, but it is close. This control panel scratches fairly easy. I have had no issues of broken or flimsy doors (Or leaks yet, I hope not) but I did buy the 5 year extended warranty.Finally, what I do like about this washer. It is quiet while washing. I can smell the cleanliness when the clothes are done. The clothes spin dry very well. This machine has cut my dryer time in half. I love the touch button controls.As with all frontload machines, remember to keep the door ajar after your final wash. This will keep your machine from forming mildew."
5.0,"""So far best washer we've had.""","This washer beats our old Whirlpool Duet by a long shot. Purchased Duet in 2006:new bearings in 2010, 2012, 2014, new MCU ($308), clothes & washer stank after use.The price was a deal, clothes are fresher smelling, spins well enough that dryer is not taking as long, & the features ease of use is great.I would recommend this washer to anyone."
5.0,"""Moved and needed to buy new washer and dryer""","I had a Samsung that was about five years old that I liked so I stayed with the brand. Does a great job with the laundry with minimal wear and tear on the items washed. Spins out very, very dry. There are a great many choices about cycle and treatment. I like that it has a spin only setting which my previous washer did not have.Not fond of the faux chrome look. Would prefer something more utilitarian looking in my laundry room but understand this is not the trend."
5.0,"""Great Machine""","No problems so far. It is real easy if you read the owners manual first. Hoses DO come with the machine. Sales man tried to sell me a set but the old ones were still good. I was just going to replace the washers but there was a new set of hoses in the washer. I got a Military discount on top of the sale price = Great Deal. Set up was a breeze did it all myself. No problem balancing. Settings are many. We ended up with the Heavy Duty, Eco warm, fast spin and heavy soil. Programed it in to memory, ""My Setting"". Clean fresh smelling almost dry clothes every time."
5.0,"""Love this machine""","I had this washing machine for a month and so far I haven't had any problems with it.Delivery was on time and after reading the manual it was ready to do laundry.I didn't get the pedestals and actually I think its best if the machine sits on the floor. It washes quietly and you don't even hear it running until it is spinning the clothes out. I don't know why some people complain that it is loud when spinning. Yes it does make noise when on the spin cycle but that is normal. Sometimes the machine does get off balance but the machine stops itself and automatically balances itself. This is normal for a front load machine because the clothes are tumbling unlike a front load washer where you place the clothes evenly and they stay that way.I tried every cycle on this washer and I think my favorite is bedding because it uses the most water. It does clean clothes real good even on normal which uses the least amount of water. The first load I did I had a shirt in the washer with oil stains from frying food and the washer took the stain out and I was impressed.Some people complain that there is water in the soap container, mine doesn't have water in the soap container. Maybe they didn't level the machine good? Also with the soap container the plastic inserts act as siphon cap, so if you don't leave the blue liquid fabric softer plastic piece in, the water will not drain.This is a good washing machine and I haven't had a single problem with it. Just remember to REMOVE THE SHIPPING BOLTS, Level the machine and RUN THE CALIBRATION MODE by pressing Temp and Delayed end at the same time then press the start button. Calibration mode is important because once the machine is leveled and isn't wobbling on any of the 4 corners, the calibration modes adapts the machines drum spinning and provides a more accurate weight level for water to be added to the machine.Now to save for the matching dryer. I am in love with laundry now, the machine performs beautifully and she is a beauty to look at too. Laundry is no longer a chore with this machine, it is a pleasure.also the seal drains real good, I do wipe it down to prevent mold and I also leave the door open a little bit so the machine can air out for a couple of hours after I used it."
2.0,"""Good Washer - But has quit working after 7 months""","Prior to last week I would have given this product 5 stars, but it just quit working. No 7 month old appliance should quit in this time-frame. Fortunately, it is still under manufacturer and extended warranty."
5.0,"""ABSOLUTELY LOVE IT!""",Gets the clothes super clean. Its so quiet most the time I don't even know its running. I finally have a washer big enough to wash my extra thick king comforter. no complaints
2.0,"""Letters on control panel wipe off""","The washer works pretty well for washing clothes and I have no complaints besides the control panel. The lettering for all the controls and settings on the control panel are not affixed, or printed on the panel well. My experience was one day I walked up to the washer and a couple of settings were smeared real bad. I tried wiping them lightly with a soft dry cloth and they just wiped off. I then dabbed them with water and it removed the smeared part but other parts were still there. Then a couple of months later same thing. Samsung will not fix it, they claim it is cosmetic and it is not covered. When the lettering wipes off the control panel and you cannot read the settings I think it is more than cosmetic. I have seen where this is not an isolated issue with Samsung Washers, by researching the internet. By the way we only use HE detergent and do not use fabric softeners or any other products. If laundry detergent causes the lettering to come off then it is not a very good washer. Customer Service through Samsung was terrible."
5.0,"""Love it!""","I have saved 50% in water usage! as well as Landry detergent and softener. Our electric bill has also gone down, one of the best purchases we have ever made. Oh! By the way our clothes are cleaner now!"
5.0,"""Love it so far""","I've never used anything but a bog-standard washer before, so the array of settings and the way you can combine them selectively is great. I haven't tried out all of them yet, but I especially like the ""no spin"" option for semi-delicate stuff you just want to wash, drain and hang out on the line. Cleans well; quickly when you need it for light-to-regular loads; deeply when you're washing grubby work clothes or something the cat has barfed on. Mainly though, the ""Merlot"" set we bought is a really pretty shade of red - if you're going by the online photos alone, this Samsung set is a bit darker than the comparable LG set Lowe's offers, which is more of a bright fire engine red. Red appliances won't work in every setting, but this one does for us, and there's no need to hide it in a cupboard, which was brilliant as we didn't have the space to do that in our tiny laundry room. Have had lots of compliments on the color.Word to the wise - read the instructions before cleaning the filter (yes, there is a filter on it, recommended for cleaning every two months). Some water will drain out when you do this, so make sure you have something in which to catch it. Also, like most front-loaders it benefits from an airing-out after a wash to avoid mustiness; I speed this up by wiping down the door and drum with a clean cloth first."
1.0,"""Didn't last""",We bought this washing machine 4 years ago and after that time the bearings and drums need replacing due to balance issues. We won't be buying another Samsung as the technician said this is a common problem with this brand.
5.0,"""great purchase""","my wife loved it when i bought her maytag topload HE set and it was very bad left the clothes shribbled n just like twisted, so i returned them for samsung front load HE and the difference is incredible best set ever clothes come out rinkle free ..."
4.0,"""Satisfied so far""","They had all items purchased in stock, so delivery was fast. This is my first front loader, but I have LG/Samsung flat screens and really like the quality of the brand. Washer is a little noisy at times until the load balances out. The dryer is great and both units have a lot of feature and is easy to use. The washer has a filter that will need to be replaced periodically (I didn't know that at time of purchase. But after a week of use I'm very happy and they fit perfectly in the laundry room.The guys that delivered and set it up were very nice and professional."
5.0,"""Such a good purchase!""","I had a Whirlpool Duet for 10 years & when it was dying I did a lot of research on high efficency washers. I seriously debated between the Sumsung and a LG both with the steam cycle.The capacity of this washer is greater than my old machine and much quieter. The other aspect that I really appreciate is that the machine seems to do better with larger loads and is does not do the loud sounds that my Whirlpool used to make. The 10 year warranty was a nice surprise, although the reviews on the warranty are rather sketchy.The added bonus for me was the color of the machine and the sale price was what finally sold me on the Samsung. I'm so pleased with this purchase!!My only negative comment was getting the machine from Lowes to my home, as delivery to my area was not an option. (Common Lowes, you delivered to me in the past.) As a single person who does not have a vehicle large enough to transport this was disappointing. I offered to pay more for delivery and ended up renting a truck to get it home."
1.0,"""Samsung Front Load Washer VERY disapointing""","I purchased this washing machine brand because the manager of the Canandaigua, NY Lowe's Appliance department touted its outstanding qualities in comparison to other front loaders. Unfortunately, after using it for one day, I completely disagreed with the Lowe's manager. A new one was delivered a week later (annoying), but there was no difference, with the exception of the dents that came with the first washer.  The first issue (remains) the 'racking' of the washer when I put it on high spin, which I never do anymore because my whole house vibrates! The high spin is supposed to be a quality of this machine, as it reduces drying time. I went on-line to query what other Samsung washing machine owners have experienced and found that I was not alone with this problem. One Samsung washing machine owner used boat bumpers to stabilize the machine when it was spinning and walking all over the floor. I have done that (on both sides!) and it does help.  When they saw the bumpers, the Lowe's manager and delivery persons agreed that I should not have to do this...duh! By the way, the machine is perfectly balanced (I made sure of that by breaking out my level while the delivery person was at my home). Additionally, the Samsung front loading machine is NOT ergonomically designed, as it is very difficult to remove clothes from the washing barrel.  Finally, the bleach dispenser does not work properly, as it dispenses the bleach undiluted into the washing barrel (completely ruining several items).I caution anyone thinking of purchasing a Samsung front load washing machine 4.2 cu ft high efficiency stack able front-loader washer with steam cycle."
5.0,"""Great Wash Machine""","We have had our machine for only a week but I can already tell that it is a cut above the Kenmore appliances we replaced after only 5 1/2 years. Runs quietly, cleans with less detergent and water and is so easy to operate."
1.0,"""WORST FRONT LOADER!!!""","Had this machine delivered and a little over 2 weeks later it started a slow leak from the door. Lowes swapped it out for a new one and the very next day on my 3rd load, the same thing happened and also every time I start a new load I have to empty the water from the area where you put the detergent in. It was FULL of water. The first machine didn't do this - UGH!!! Now they are sending out a repairman to adjust the door!!! Which shouldn't leak in the first place, it is 1 day old! NOT HAPPY AND WOULD NOT RECOMMEND SAMSUNG! Can't wait"
5.0,"""Amazing Washer!""","This washer is amazing! Incredibly easy to use. The quick wash only takes 26 minutes. It's very, very quiet. The audible alerts are a bit annoying, but I keep them on so I know the thing is working. It really makes no sound at all except at the very beginning and end of the cycle as the drain pump works.It does come with 2 rubber fill hoses, power cord and a drain hose. But I definitely recommend getting stainless steel braided fill hoses that are guaranteed not to burst.This is a VERY heavy item. The delivery cost (if applicable# is worth it!The only Con to this particular item is that the door is NOT reversible. It opens from right to left only. This renders the ability to reverse the door on the matching dryer #565990 electric or 565991 gas) completely useless.While not really a pro or a con, it does take some getting used to the time it takes to wash a load. The quick wash is 26 minutes; but a heavy soiled, steam wash, extra spin, extra rinse will take 3 hours and six minutes."
3.0,"""a year later-not so sure""","the soap dispenser keeps water in it-it does not always drain. tech can't fix. I live in high humidity and the plastic dispenser (where you put soap, bleach, fabric softner) always molds and so does the rubber seal. it is impossible to keep clean. I would not purchase again in an area of high humidity. also, a hand wash feature would be nice."
5.0,"""Love it!""",Very happy with this purchase. Quiet operation. Easy to use controls. Love the clean cycle; no more buying washing machine cleaner and no more smelly washing machine. Love that it reminds you every 40 loads so you don't have to remember to run the clean cycle.
1.0,"""Dont buy samsung""","Excessive mold issues, mold internally that you cant see unless you disassemble the drum.  Major part failure at only 5 years, a know defect that samsung customer service ignores but knows very well.  Look at the pictures.  That is mold inside the drum, you cant see it unless you disassemble the machine.  The corrode part has an inch thick of corrosion, finnally cracking.  Repair was $400 by a technician so I had to do it myself.  Do not buy a SAMSUNG.  Look at the pictures, there is a pic of the replacement part.  Our clothing was being washed in this mess.  Also, all the internal hoses were full of mold and smelled horrible."
5.0,"""Amazing Washer""","I bought this washer just one week ago and have already used every cycle it has. I can't believe this washer - best washer I've ever owned. It is quiet, efficient, and as far as quality goes, it has my previous washer beat in every department. I had a Whirlpool and it went out 3 times in just over 4 years. So we went with this Samsung because of Consumer's Reports reviews and we aren't one bit sorry. Recommend this washer to anyone looking for quality and not a huge price tag. For those who say their washer is noisy and walking across the room - be sure all four corners are leveled with the floor and it does work best on a LEVEL floor such as concrete or tile. And be sure to read your operating instructions thoroughly because a front loader is much different from a top loader."
1.0,"""Very low quality""","Not long after we bought our washer, but just outside the warranty period, the latch on the door starting acting up. It cost over $300 to get it fixed. Just for a small little latch. Watch out for repairs."
2.0,"""Excellent in efficiency at the cost of cleaning""",We have now had this washer for 3 months and I have to say I wish I had taken it back. It work well in the fact that its capacity is amazing we rarely ever fill it to capacity. The spin cycle is really amazing compared to most washers that we have had. Clothes are practically dry before moving to the dryer and this is where the issue is. I don't think this uses enough water to even wash my cloths. Almost every load I have to rerun my shirts as they rarely smell clean and usually still stink of body odor.We have tried all kinds of settings but it just doesn't use a lot of water.
5.0,"""Don't hate on front loaders!""","After days of reading reviews from four different stores on top loaders & not being able to settle on one that had decent reviews, we ended up at our local Lowes who was finally able to fit us with a fantastic machine that would clean our family of four's clothes with ease. One of which, is a logger & comes home full of saw dust & mud on a daily basis. This washer does tend to become off balance for a few seconds causing it to become a little loud during it's spin out, but quickly comes back in balance & does a fantastic job! I never even wanted to look at front loaders due to so many negative reviews, but because of my husband's work, this is what was recommend to us. I absolutely love it!!! I plan to regularly clean it like recommended, I wipe down seals after every use, & keep the door open so air can pass through. I have also noticed you may have to remove the soap tray to wipe it out also."
4.0,"""Good Purchase with Reservations""","This Samsung washer is a large beast, and even larger mounted on a pedestal. Lowe's delivered and installed the machine which ran well during the install test. However, the machine rocked and rolled unacceptably during the first load: a California king fleece blanket. Because it was the only piece in the machine, the drum action caused the blanket to wind over on itself, so at the end of the cycle, the center of the wound up blanket didn't seem to have been washed.A second load, with more pieces, produced a better wash, although the machine vibration persisted. A few days later a Lowe's technician adjusted the machine, tightening it to the pedestal. He said that the pedestal mount is not as stable as having the machine sit directly on the floor, so some vibration was inevitable. Also the machine was built to handle heavy loads, and a small load would cause some unbalance and result in some vibration. My next fuller load was better.So here's the skinny: level all sides of the machine, tighten it securely to its pedestal if you purchased one, and wash large loads. We're keeping ours."
5.0,"""Great product, great service!""","I've only washed a few loads so far and I haven't had any issues, nor would I expect to this early. I am concerned about the extremely low water levels but apparently this is normal and the machine is operating as it should. Clothes come out clean and smell great!I was even more impressed with the online ordering process with Lowes. This particular washer and dryer set was out of stock at my local Lowes but the town over had them so I ordered them from there. Less than 24 hours later, I was washing clothes in my new machine that Lowes delivered, setup and even tested before they left. Super great service!!!"
1.0,"""Dont Buy SAMSUNG""",Bought this washer less than 18 Months ago and just had to spend almost 600.00 in repair costs. Took almost 3 weeks to get a Samsung authorized repair person to look at it.
