ratings,review_titles,reviews
4.0,"""Good purchase""","I recently purchased the Samsung washer and so far I'm not disappointed. It is very quiet and easy to operate, love the chime at the end of the cycle. The laundry comes clean, but even with the extra spin it is still too wet."
5.0,"""Love this machine!""",I purchased this washer machine a few months ago based on the reviews and I absolutely love it. My clothes always come out fresh and clean and the appearance of this platinum washer is high end. I am happy over all.
1.0,"""Broke twice in less than 2 years""","Purchased both the washer and dryer.  In less than 2 years, we've had to repair the washer twice and the dryer once."
1.0,"""Worst washer ever!!!!""",after 2 years this thing is so noisy and traveling all over and supposedly needs new drum. We have warranty so off to buy another. Have no idea what to get. It definitely will not be a Samsung.
5.0,,There is no review to accompany this rating.
1.0,"""Won't Last""",This was my first high efficiency front load washer and was so happy when I bought it. Then it started getting louder on the spin cycle. You must keep cleaning filter to keep smell at bay and I recommend leaving door open for mildew is a big issue.  Now it is too loud to even run it and in the end it kept re-cycling and I had to manually cut it off.  Everone says it is due to the zinc parts corroding since up against alluminum parts.  Samsung says it only has a 1 year warranty. I am not a rich person who can replace appliances every 6-7 years.  I need them to last. I am laundromat bound.
4.0,"""great washer.""",Purchased washer a week ago and so far so good. Seems to remove stains and spins dry clothes better than previous washer. Pedestal should be included since front loading /unloading access is too low for me.
5.0,"""Very Good""","This is my second Samsung front load, the other was still working fine and was a bit smaller, so upgraded with this 4.2 @ Black Friday awesome price. This machine has great features, the Steam is great for whites, stains, tennis shoes and things that need deep cleaning. The option for added rinse, spin, pre soak are nice when needed. Front loaders do a very good job cleaning your clothes. I use HE detergent, and only a tablespoon for normal loads as I have soft water. Old top loaders used so much water and diluted the soap so I had to use more. This machine effectively tumbles the laundry thru a smaller amount of water and is gentler on the clothes. Spin cycle does well, and dryer keeps up with the washer on normal settings. As with any front loader, I leave the door open when not in use and have had no smell or mold with this or my last machine. If your setup doesn't allow for the door to be ajar, you may have a musty smell. I love the value, performance, and features of this washer. I hope it will last for 10 years, as nothing made today is made to last as machines were several years ago. My job is delivering appliances so I see all the names. There is occasionally a faulty unit, no matter who the manufacturer is. The extended warranty may be worth considering with ANY new appliance. This Samsung on sale was a great value for the size, and all the features it offers, and a solid performer."
5.0,"""Good price""",There is no review to accompany this rating.
5.0,"""Chimes""","Fantastic washer, quiet, efficient, never goes out of balance when the kids overload it with towels! The chimes when it completes are the best."
5.0,"""WASHER FRONT LOAD""",SO FAR VERY BEST WORK STILL NEED TO WORK MORE WITH ITEM
5.0,"""Awesome Washer""","Love my new washer, lots of features, design is beautiful, compliments my utility room better than that old white thing. Takes a little while for a load to wash, unless you use the quick wash. But I always add an extra rinse to my loads so it adds a little time. Does a great job on getting my clothes clean. Have no problem with bad smell coming from washer, but I leave the door open after I am done. I also wipe it down after done. Maybe because it is so new and want to keep it looking good. Quiet machine also, could hardly hear it just outside utility room door. Was beginning to think it wasn't washing clothes. Looked inside and sure enough it was running, just as smooth as can be. ."
5.0,"""nice machine""",well designed and easy/intuitive to use. quiet and sleek
5.0,"""love the features""",This washer has all the features that we need and truly love the ease of use.
5.0,"""Samsung washer""",Easy to use. Many options for the wash cycle. Clothes come out much cleaner than my old top loader. Love it.
4.0,"""Has the features we wanted""",Have just installed and started using the washer and so far so good. Like the option of steam and a self cleaning button for the drum and seals with a reminder.Also like the easy access for the tub drain line trap.
4.0,"""Great, but louder than expected.""","We purchased this washer, the matching dryer, and pedestals six months ago. Everything is working wonderfully but the washer is much louder than I expected it to be. It is louder than our 12+ year old washer that it replaced. The rinse and spin cycles are very loud, to the point where I make sure to not do a load of wash while the baby is sleeping. We have spaced our machines a few inches apart, don't overload them, and have double and triple checked that they are perfectly balanced/level on the ground yet the washer drum bangs very loudly when it spins quickly. We have tried to fix the problem by selecting slower spin speeds, but that decreases the amount of water that is removed which increases drying time. I like the self cleaning feature, but it is also affected by the loud drum issue. It takes four hours to run that cycle so I would like to be able to turn it on before going to bed for the night, but because of the noise we have to try to remember to run it when we will be out of the house for several hours. Luckily, it is only once a month based on our usage (at least one load of laundry per day, 6 days a week). I do love the various cycle options, and that the display tells you exactly how long you have until the load is done. The song that plays at the end of the cycle is also a fun alternative to a loud buzzer. Overall I am pleased, but I wish it were a little quieter."
4.0,"""Looks impressive and a lot of great features""","Overall, I would give this one 4 1/2 stars. We love everything about it so far. My only complaint is the beginning of the spin cycle is louder than our old washer. The noise only lasts for 15 seconds or so. Perhaps the load is balancing as the washer drum is speeding up?"
5.0,"""Great washer, even at the lower consumer end""",Clean design and functionality. We had to replace an older Samsung washer and this model was the best one available in our price range. Quiet operation. Cleans well.
5.0,"""User Friendly""","My grandchildren love to help me wash and dry clothes, love pushing and reading the correct buttons"
5.0,"""Wonderful Washer""",Samsung is a new brand for me. The machine performs wonderfully and has many nice features!
5.0,"""Perfect product""",Very good price.The cycles are longer that the previous machine we had here but this should not be a problem.For the rest everything is OK.
5.0,"""So far so good""",My last washer lasted 11 years. So I went on the hunt for a new washer. There were so many out there I needed to narrow the feel. So I turned to the Internet. I asked for the top ten washers and Samsung was high on several list. I have several Samsung products and have had great service. When I saw the Samsung washer compared to the others I did not hesitate.
5.0,"""Great Washer""","I love the steam cycle, it improves the washing of my clothes. And I now have a self cleaningcycle, which my machine alerts me it's time to clean."
5.0,"""This product has great features""",Very nice looking appliance that does more than I ever imagined a washer could do.
5.0,"""Awesome Washer""","Best washer we have ever owned. It runs virtually silently, has multiple cleaning modes and does a great job."
5.0,"""LOVE THE DESIGN AND FEATURES!!!""","SUCH A GREAT UPGRADE TO THE LAUNDRY!! LOVE THE DESIGN AND FEATURES THAT THIS LIL BEAUTY HAS......LOOKS GREAT AS A SET, STACKED....WHEN IT IS WASHING A LOAD, LOOKS LIGHT ART IN MOTION.....IF YOUR LOOKING FOR AN UPGRADE WITH LOTS OF FEATURES AND SETTINGS, THEN THIS IS THE WASHER FOR YOU...."
4.0,"""great features""","love the smart options and the time on the digital readout is real time not ""laundry time""."
5.0,"""This washer fun""","This washer really spins the close dry and is also a fun washer to use, love the tunes Samsung,"
1.0,"""This is not a machine for someone who actually has dirt or grease on their close""","Will be returning this machine and getting a washer with an agitator !!!!!! Worst purchase I have ever made !! Will not remove dirt ,grease,or oil ! Even set on heavy duty with all the extra functions wich is a 2 hour wash cycle that can take up to 3.5 hours !!!! Half of wich is setting there doing nothing while it try's to figure out how to balance itself . What a waste."
5.0,"""Excellent product""",Worth for $$$$ and would suggest this product. Impressed.
4.0,"""Great!""","This is very nice machine. There is just one important item that someone forgot to integrate into the design. WHERE IS THE INTERIOR LIGHT??? It gets dark in that drum. I don't know about anyone else, but I like to be able to see what's going on in there! Put the light in please!"
5.0,"""easy to use washer""","Love the usability, many features and cycle choices on this washer. It plays a great little tune at power on & at end of cycle. Easy to use & a real water and power saver. Child safety lock is a great feature."
5.0,"""Great Product""","Bought this washer after much research, since it was replacing the machine I bought 23 years ago. It's been great! Very easy to use since it came with clear instructions. Clothes look and feel great after washing!"
5.0,"""Impressed""","We are absolutely impressed by our new washer. It is amazing how little water is uses yet how much cleaner the clothes are vs. a standard top loading washer. I am very, very pleased so far!! Thank you Samsung for a great product!!"
5.0,"""Great friend for the dryer""",Definitely a great buy. I was hesitant with the price but it was well worth it. This with the dryer pair is amazing. Quiet and performs well.
5.0,"""HAS A GREAT FUTURE""",SO FUNCTIONAL WASHER ..EVEN THERE IS STEAM CLEANING.WHAT CAN YOU ASK MORE
4.0,"""Great washer, fast and silent""",This washer doesn't vibrate as others of the same kind. It has differents cycles depending on the type of load and it is fast.
5.0,"""Chimes""","Fantastic washer, quiet, efficient, never goes out of balance when the kids overload it with towels! The chimes when it completes are the best."
4.0,"""Less than 2 weeks old and makes noise when draining water, wobbles even after having been balanced""","Overall this machine works great however; even after having balanced the unit on the pedestal it still wobbles at low speeds. The humming noise it makes when drawing water out of the unit is a little unsettling too. At less than two weeks old I question if these are noises it should be making.But again, it does the job it was purchased for. It cleans the cloths well, looks great and doesn't sound like it's trying to run away when it's spinning."
5.0,"""WASHER FRONT LOAD""",SO FAR VERY BEST WORK STILL NEED TO WORK MORE WITH ITEM
5.0,"""Samsung washer""",Easy to use. Many options for the wash cycle. Clothes come out much cleaner than my old top loader. Love it.
4.0,"""Has the features we wanted""",Have just installed and started using the washer and so far so good. Like the option of steam and a self cleaning button for the drum and seals with a reminder.Also like the easy access for the tub drain line trap.
4.0,"""Great, but louder than expected.""","We purchased this washer, the matching dryer, and pedestals six months ago. Everything is working wonderfully but the washer is much louder than I expected it to be. It is louder than our 12+ year old washer that it replaced. The rinse and spin cycles are very loud, to the point where I make sure to not do a load of wash while the baby is sleeping. We have spaced our machines a few inches apart, don't overload them, and have double and triple checked that they are perfectly balanced/level on the ground yet the washer drum bangs very loudly when it spins quickly. We have tried to fix the problem by selecting slower spin speeds, but that decreases the amount of water that is removed which increases drying time. I like the self cleaning feature, but it is also affected by the loud drum issue. It takes four hours to run that cycle so I would like to be able to turn it on before going to bed for the night, but because of the noise we have to try to remember to run it when we will be out of the house for several hours. Luckily, it is only once a month based on our usage (at least one load of laundry per day, 6 days a week). I do love the various cycle options, and that the display tells you exactly how long you have until the load is done. The song that plays at the end of the cycle is also a fun alternative to a loud buzzer. Overall I am pleased, but I wish it were a little quieter."
4.0,"""Looks impressive and a lot of great features""","Overall, I would give this one 4 1/2 stars. We love everything about it so far. My only complaint is the beginning of the spin cycle is louder than our old washer. The noise only lasts for 15 seconds or so. Perhaps the load is balancing as the washer drum is speeding up?"
5.0,"""Beautiful Looking and Great Product""",I love the look of my washer and dryer. It also works great!It's up there with my high standards of appliances.
5.0,"""Great washing machine!""",Works wonderfully. Easy to use. Very durable and great design.
5.0,"""Great washer, even at the lower consumer end""",Clean design and functionality. We had to replace an older Samsung washer and this model was the best one available in our price range. Quiet operation. Cleans well.
5.0,"""User Friendly""","My grandchildren love to help me wash and dry clothes, love pushing and reading the correct buttons"
5.0,"""Excellent choice with great features""","I've always wanted this color. This is my second front load washer and if at all possible would not go back to the top load. This color is beautiful, easy to use and my goodness, the clothes are almost dry when the cycle is complete. The value is great, less water and detergent without having to give up my clothes being so clean. Quiet and the steam is phenomenal. Also the music it plays when the cycles are complete is so much better than the ""alarm"" that scares you to death. Highly recommend."
5.0,"""This product has great performance and features.""",This product has great performance and features. I love Samsung products. I used this product 5 month. I recommend SAMSUNG to my friends.
5.0,"""What a great product""",i have never had a front loader before and wasnt sure i wanted one but bit the bullet ....love it...never go back again this samsung works great
5.0,"""Great washer""","Great Washer,good price! It's a washer so it's supposed to clean clothes so it does!"
5.0,"""Love my new Washer!""","I love this washer. There are so many cycle options to choose from, which makes cleaning all my different clothing items a breeze. I've had no problems with it so far, it's balanced well, not noisy at all, and I LOVE the little jingle it plays at the end of a cycle. It makes doing laundry actually fun! After a cycle, I leave the door open and wipe it down, as well as the detergent tray to help prevent any mold growth as is common on front loading washers. I enjoy the steam cycles, but find I don't use them as often as I thought I would. Mostly just for when I do the sanitize cycle for towels or sheets. But having young children, that cycle is a MUST HAVE for me! Any sickness, bed wetting, or whatever else comes along gets washed right away with that sanitize cycle! I love it. The display is wonderful. Very easy to read and find what you want. The ""buttons"" on the display aren't real push-in buttons, just touch, and I know that bothers some people, but I'm fine with it. It's actually better to me that they don't wear out fast.  Overall, an excellent washer and does a great job for my needs. I would definitely recommend this washer to a friend!"
5.0,"""Washer""",Love my washes looks so nice in my new house. Love everything about it!
5.0,"""Chimes""","Fantastic washer, quiet, efficient, never goes out of balance when the kids overload it with towels! The chimes when it completes are the best."
4.0,"""Less than 2 weeks old and makes noise when draining water, wobbles even after having been balanced""","Overall this machine works great however; even after having balanced the unit on the pedestal it still wobbles at low speeds. The humming noise it makes when drawing water out of the unit is a little unsettling too. At less than two weeks old I question if these are noises it should be making.But again, it does the job it was purchased for. It cleans the cloths well, looks great and doesn't sound like it's trying to run away when it's spinning."
5.0,"""WASHER FRONT LOAD""",SO FAR VERY BEST WORK STILL NEED TO WORK MORE WITH ITEM
5.0,"""Awesome Washer""","Love my new washer, lots of features, design is beautiful, compliments my utility room better than that old white thing. Takes a little while for a load to wash, unless you use the quick wash. But I always add an extra rinse to my loads so it adds a little time. Does a great job on getting my clothes clean. Have no problem with bad smell coming from washer, but I leave the door open after I am done. I also wipe it down after done. Maybe because it is so new and want to keep it looking good. Quiet machine also, could hardly hear it just outside utility room door. Was beginning to think it wasn't washing clothes. Looked inside and sure enough it was running, just as smooth as can be. ."
5.0,"""LOVE THIS WASHER""",This is one of the best washer's I've ever purchased. It's beautiful sleek design looks amazing in my home. My clothes have never felt cleaner.
5.0,"""Samsung washer""",Easy to use. Many options for the wash cycle. Clothes come out much cleaner than my old top loader. Love it.
4.0,"""Has the features we wanted""",Have just installed and started using the washer and so far so good. Like the option of steam and a self cleaning button for the drum and seals with a reminder.Also like the easy access for the tub drain line trap.
4.0,"""Great, but louder than expected.""","We purchased this washer, the matching dryer, and pedestals six months ago. Everything is working wonderfully but the washer is much louder than I expected it to be. It is louder than our 12+ year old washer that it replaced. The rinse and spin cycles are very loud, to the point where I make sure to not do a load of wash while the baby is sleeping. We have spaced our machines a few inches apart, don't overload them, and have double and triple checked that they are perfectly balanced/level on the ground yet the washer drum bangs very loudly when it spins quickly. We have tried to fix the problem by selecting slower spin speeds, but that decreases the amount of water that is removed which increases drying time. I like the self cleaning feature, but it is also affected by the loud drum issue. It takes four hours to run that cycle so I would like to be able to turn it on before going to bed for the night, but because of the noise we have to try to remember to run it when we will be out of the house for several hours. Luckily, it is only once a month based on our usage (at least one load of laundry per day, 6 days a week). I do love the various cycle options, and that the display tells you exactly how long you have until the load is done. The song that plays at the end of the cycle is also a fun alternative to a loud buzzer. Overall I am pleased, but I wish it were a little quieter."
4.0,"""Looks impressive and a lot of great features""","Overall, I would give this one 4 1/2 stars. We love everything about it so far. My only complaint is the beginning of the spin cycle is louder than our old washer. The noise only lasts for 15 seconds or so. Perhaps the load is balancing as the washer drum is speeding up?"
5.0,"""Great washer, even at the lower consumer end""",Clean design and functionality. We had to replace an older Samsung washer and this model was the best one available in our price range. Quiet operation. Cleans well.
5.0,"""Love this washer""","I have never had a front load washer.I was a little reserved to by one as others talked about the moisture that stays in the drum.After talking to the salesman, he recommended propping the door open & leaving the soap tray open a little.I have been doing this and it is working just fine. I put a rolled up wash rag in the top of the door to hold it open.With that being said I love my washer."
5.0,"""Love my new washer but.....""",Really happy with our purchase! I love the washer and how well it cleans. One thing that I dont like it the fact that you have to buy the pedestals and that they are such expansive add ons for just a drawer. The washer is so low I have to get on my knees to get the clothes out which is taking a toll on my back.
4.0,"""So far so good!""","Just purchased this washer for a very good price and was excited when it arrived, very impressed with the color and chrome. A nice feature on this dryer is that during spin it will rebalance itself so its never excessively noisy."
4.0,"""Congratulations Its'a washer!!""","A decent washer. It has a great size handiling a good size load. Plenty of wash options, more than my wife and I, and most people would use. Not to loud except on the spin cycle. On the spin cycle it seems intermittent, start spinning then stopping, only to start again. The door sticks a little and even my wife thinks she is going to break it when pulling it open. Would love it to stay on delicates when powering up since it is our most common preference. All in all not to shabby of a washer for the price. Oh yeah and beautiful color!"
4.0,"""Great Features""","Features are great. Have just received product, so cannot speak to the operation or use at this time."
5.0,"""so far so good""",just bought washer a couple of weeks ago works great and hope it does for many years to come
5.0,"""Works well""","This washer met my expectations. Its important to leave the door open after use to avoid sitting water which leads to mold. Overall, it cleans well and has a lot of good features"
5.0,"""This product has great features, I love the steam setting...""","I previously had a front load by another company it was loud, clothes did not rinse well The Samsung product is quite, easy to use, I love it and I would recommend it to anyone......"
5.0,"""Great Washing Machine""",This is a great value and a great machine. It is highly recommended.
5.0,"""LOVE THE DESIGN AND FEATURES!!!""","SUCH A GREAT UPGRADE TO THE LAUNDRY!! LOVE THE DESIGN AND FEATURES THAT THIS LIL BEAUTY HAS......LOOKS GREAT AS A SET, STACKED....WHEN IT IS WASHING A LOAD, LOOKS LIGHT ART IN MOTION.....IF YOUR LOOKING FOR AN UPGRADE WITH LOTS OF FEATURES AND SETTINGS, THEN THIS IS THE WASHER FOR YOU...."
4.0,"""great features""","love the smart options and the time on the digital readout is real time not ""laundry time""."
5.0,"""This washer fun""","This washer really spins the close dry and is also a fun washer to use, love the tunes Samsung,"
5.0,"""washer""",This is a very nice product with all the bells and whistle's I love the smart feature too
4.0,"""Nice but some limitations""","We replaced our old front load washer and overall this is nice.It washes well and is quiet. My concerns:1. Upon spin completion it should rotate back and fourth a few more times to release the items from the drum. Unfortunately it does not and I have to reach around to pull some items off the drum, or manually spin the drum to find them.2. The modifiers are limited. Our old front loader allowed unlimited temperature and spin speed settings. Certain cycles on this machine limit the options.These are all firmware issues that should be re-programmable.Otherwise a good machine.  I only gave three stars for value as I think the buy up price over white is a bit over the top. Maybe $100.00 would be reasonable. Not $200 +"
4.0,"""Front Load Washer""",The performance of this washer is very good. It is easy to operate and no problem with electrical components. I would recommend this product! [This review was collected as part of a promotion.]
4.0,"""Good washer""",Everything is perfectly functional but the gasket around the door that is not draining water perfectly creating a bad smell unless you are drying it all the time.
5.0,"""Great Product. So many features that I love.""",This washer is the best washer I have owned. It washes heavy duty loads with ease. My family of 6 goes through 3 - 4 loads each day and this washer is up to the challenge. I love how quickly each cycle runs through. I love the steam cleaning option for delicate items and bedding.
5.0,"""easy to use washer""","Love the usability, many features and cycle choices on this washer. It plays a great little tune at power on & at end of cycle. Easy to use & a real water and power saver. Child safety lock is a great feature."
5.0,"""Impressed""","We are absolutely impressed by our new washer. It is amazing how little water is uses yet how much cleaner the clothes are vs. a standard top loading washer. I am very, very pleased so far!! Thank you Samsung for a great product!!"
