ratings,review_titles,reviews
5.0,"""Exceeded my expectations!.""","I purchased this Washing Machine because my Dad has one and I liked the way it operated. I used his a couple of times because my own WP top load was useless since it continuously became unbalanced as soon as the spin cycle started.  This machine however, balances itself so that was a plus. The fact that it is a front load means that all of the clothes get washed evenly. And since everything is now High Efficiency and less water is used that makes a big difference. Another plus is, there is no agitator to worry about wearing your clothes out prematurely. This machine also has the steam wash feature and it is great. I have had this Washer now for right at a month and I am thoroughly pleased. I work in an Industrial environment (Pulp Mill) so my work clothes get their share of abuse (Dirt, Grime, Grease, Sap, Pitch and various Chemicals also). With just the recommended amount of detergent my clothes are cleaner than they have been since purchased.   I will also be purchasing the matching Dryer unit soon."
5.0,"""Great""",Best washer ever fast and minimum noise. Very fast to wash and controls feel good. Good display
4.0,"""Great features on this product.""",I have had great results with this product. I have been very satisfied with my frontloading machine.
5.0,"""This washer has many good features""",This front load washer is just what we needed. Not overly complicated but enough options to do what we want. The price was fairly reasonable compared to other models.
5.0,"""Fantastic Front Loader in Platinum""",Love my new Samsung front load washer. Saves water and is very efficient. Love the look of the Platinum.
5.0,"""This product had features we wanted""","We bought this based on features and prices plus we have other samsung products we enjoy. We TVs, and Refrigerators at Home and Church that so far we are pleased with. Washer seems to work well. Hoping it will last us a long time!"
5.0,"""No vibrationa""",Amazing washer. I love samsung products. I was looking for a low vibration washer and I got one.
5.0,"""Great special features.""","I love the special features of this washer, especially the ""Sanitize"" and ""Allergen"" features as I am continually washing my dog's bedding."
5.0,"""Pro""",Cleans as advertised and is very quiet. First front loader and pleased with the performance.
4.0,"""an overall excellent product""",received this washer and started using it. easy to use and silent. Looks durable and has sleek design. I love the steam feature in the cycle. definitely a plus. I heard good reviews on this washer so I purchased one.I will have to comeback after a year using this product to see how it performed throughout one year at least.
5.0,"""Great product,looks awesome!""",Dryer works great and looks awesome! Cant say enough good things about this product!
5.0,"""Excellent Machine!""","This is a great washer, with great features and is so quiet! Our laundry area is down the hall in an alcove. Besides all the features that let you do a great job on your laundry, it is so quiet while running that you barely notice it while watching your Samsung TV!"
5.0,"""Lots of Options""",This machine has all of the options one needs. It does a great job cleaning and is relatively quiet. Would recommend purchase.
5.0,"""Awesome washer""",A huge improvement over our old machine. Quiet and impressive cleaning performance.
5.0,"""Great Features at a value price""",Best front load I have owned. Super hot wash with sanitize cycle is the best. [This review was collected as part of a promotion.]
5.0,"""Wonderful""","Great value, user friendly, wonderful product, the only problem is that the web site freezes during registration."
5.0,"""controls""",very easy to see the controls and I enjoy the little jiggle when it goes off
5.0,"""Love this Washer""",This is my third Front Loader washer and this is my favorite. It remembers the last load settings and automatically shuts off when it is done.
5.0,"""Samsung washer""",Best washer I've ever owned. Very convenient and beneficial.
5.0,"""One thing missing""","There is no interior light. Besides that, I really like this product."
4.0,"""Good Product Bad Design""",The power button is in a bad location. Already bumped it twice while it was washing and shut it off.
5.0,"""Nice Washer""",Looks good and has lots of option to choose from. Now testing it and clothes came out great and cleaned.
4.0,"""Nice design, easy to use""",I learned how to use my new washer in only 5 minutes! Very intuitive design and great look.
5.0,"""This product has great performamce""",This Front Load Washer does ALL the work for me AND it is QUIET !
5.0,"""works great""",Just received my new washer I love the way it works and looks
5.0,"""Easy and Quiet""","This washer is my first front-end loader and I love it. The controls were easy to figure out, it cleans great, and it's quiet. I have horses and dogs, so that laundry is for sure heavy duty."
5.0,"""First front load washer""","Wow, at first, I was not sure about a front load washer being a huge improvement over my old top load washer with agitator. But, this washer has simplified clothing washing so much, that I can't help talking about it to friends. It cleans great, from oily work clothes to blankets and uses minimal water too. If you are looking for a good washer, this is well worth the money."
5.0,"""Spins the clothes nearly dry!""","Super quiet, fast, and efficient. The washer spends the clothes nearly dry! So far no signs of mold or any strange smells."
5.0,"""Front load washer""","I was pleasantly surprised by this washer,having not usually liked front loaders. It's quiet and efficient."
4.0,"""Looks Great. Quiet""",Quiet machine. Many cleaning options. Platinum color - it's a beautiful washer.
5.0,"""Front Loading Washer and Dryer""",We previously owned a Samsung front load washer and front load dryer for 10+ years. We decided to purchase new ones in stainless steel. Our previous washer and dryer were white and we gave them to a family in need. We never had any issues with our previous machines and that's why we decided to purchase again.
5.0,"""Measure your space""",Moved up from top loader to this and this one sets a bit further from wall and therefore into room...but great product
5.0,"""My Samsung Machine""",It works great and is easy to operate and is quite. I love it.
5.0,"""Front Load Washer""",The Samsung front load washer is a great machine. I originally had a top load washer but I find that the front load washer is much more efficient and quiet. I would highly recommend the washer to anyone.
5.0,"""Front load washer""",I love this washer! Cant wait to see how everything else washes in it. Just got it so haven't washed everything. Love the looks. Love the performance so far.
4.0,"""Sleek and a super washer!""","It has what I call ""Super spin"" when finishing! Clothes were almost dry when done which me shorter dryer times and less energy used. Only problem is on the spin cycle it almost ""walked"" out of storage area. Will have to figure out how to prevent this.. Lots of options including a steam cycle. This front end loader makes it much easier since I am in a when chair..Most of the products in my Apt. now are Samsung!"
5.0,"""Excellent!""",this product is so beautiful and excellent. I will recommend this to the others.
5.0,"""NICE WASHER""",GREAT WASHER I JUST WISH I WOULD BE ABLE TO CONNECT WITH SMART PHONE.
5.0,"""Love it!""","Quiet, holds a lot and it Sanitizes!!!! I love how I can fit king size bedding and it doesn't get damaged!"
5.0,"""Great washing machine!""",Very pleased so far. Quietly washed my queen size comforter and sheets with room to spare.
5.0,"""Sweet""",Love this washer! Feels like I stepped into 5 years into the future! [This review was collected as part of a promotion.]
5.0,"""Samsung front load""",I love this product and does wash very good and also recommend to some friends of mine
5.0,"""Im so happy we bought it""",Its easy to use and with the care app i will be able to know whats wrong with my washer... next month we are gettung the dryer!!
5.0,"""Exceeded my expectations!.""","I purchased this Washing Machine because my Dad has one and I liked the way it operated. I used his a couple of times because my own WP top load was useless since it continuously became unbalanced as soon as the spin cycle started.  This machine however, balances itself so that was a plus. The fact that it is a front load means that all of the clothes get washed evenly. And since everything is now High Efficiency and less water is used that makes a big difference. Another plus is, there is no agitator to worry about wearing your clothes out prematurely. This machine also has the steam wash feature and it is great. I have had this Washer now for right at a month and I am thoroughly pleased. I work in an Industrial environment (Pulp Mill) so my work clothes get their share of abuse (Dirt, Grime, Grease, Sap, Pitch and various Chemicals also). With just the recommended amount of detergent my clothes are cleaner than they have been since purchased.   I will also be purchasing the matching Dryer unit soon."
5.0,"""Great""",Best washer ever fast and minimum noise. Very fast to wash and controls feel good. Good display
5.0,"""Love them""",Since we got this cannot complain. Plus they are super quiet.
5.0,"""WISHY WASHER""","Very luxurious look. Only thing I didn't like about it, I can't swap the door to open from the left side. My contractor already placed the dryer on left side of washer. Therefore the dryer's pipes length are set and can't swap dryer to the right side of washer. I was able to reinstall the dryer's door to open from the left side. But the washer doesn't allow you to reinstall the door to open from the right store. Therefore, I can't toss my clothes from washer to dryer directly. I have to bend up and down to take the clothes out of washer and lift above the door to toss it into the dryer."
5.0,"""Great item""","Well I have to say this is the best washer we have ever owned , its quit , fast and almost dries the cloths before going to the dyer, I would recommend this to everyone. Fantastic product"
4.0,"""Real Nice Steam Washer""",Just purchased unit and already ran 4 loads through it seamlessly. Only problem was the door latch had not been tightened. Nothing a screwdriver could not fix (after confirming with customer support the latch it supposed to be tight). This is my first Samsung appliance. Hope is lasts longer than the LG steam washer it replaced (12yrs on that one)
5.0,"""Love my Washer!""","Having had an older Whirlpool Duet, I was hesitant to buy another front loader because the old washer had been a problem from the minute we bought it. I have had my Samsung for about 4 months and I am in love with it. The only thing I miss is the Whites cycle, although the steam cycle is similar."
5.0,"""tHIS PRODUCT IS EASY TO USE""",I LOVE IT!!! IT IS VERY EASY FOR EVERYONE IN THE FAMILY TO USE
5.0,"""Love them""",Since we got this cannot complain. Plus they are super quiet.
5.0,"""Great Product""",This is the first front load washer I have owned. It works Great!My husband was amazed at how quiet it is while running. He even shined a flashlight through the window to see if it was running.
5.0,"""I REALLY LIKE THE MERLOT TWINS""","Let me just start by saying I love tools or I should say I love tools that work really well. I will say before I continue my review that I had the original set for 10 weeks until they were replaced by a new set because the other ones were vibrating pretty badly but in my opinion that had a lot to do with the installation. I did two months of research before choosing the twins. And for most of that time I was looking at Toploaders because the reviews said you have to keep the front loaders door open so it dries out. And I have to admit that put me offer a little bit until I realized that I always leave my Toploader washer machine Open after it's finished.My new twins are a dream and are living up to my expectations as to how they should operate when they're working properly. For This review I""m talking about the washing machine it runs super smooth and quiet. What I didn't really Count on was how much better my clothes would be cleaned. My whole life my experience has only been top loaders so this is my first front loader experience. And I got the pedestals mainly for the storage convenience. And they put them at the perfect height for transferring clothes from one to the other. You'll see in the photo I got a little crazy with the painting of the room so as to give the greatest contrast to the merlot color. I will probably have to tone it down my wife thinks it's a bit much. The washing machine really does spin them so well that the dry time is shorter. And I'm sure everybody can relate to this when we've left them in the dryer and didn't take them out the clothes were a little wrinkly. I just put them through the wrinkle away mode and it worked great. And it is really nice to be able to turn off the notification sounds."
5.0,"""Love this machine""","this machine is very good looking not to big and not to small. First time buyer for a washer and dryer from Samsung but now I am hooked, the quality is great a very low noise level when the machine is working. Love all their products."
5.0,"""It's great!""",The Samsung washer I just bought is wonderful. It has many features to meet my needs. The ability for it to be stacked or positioned side-by-side with the dryer is a plus.
5.0,"""great washer""","We love this Samsung washer. Large drum, little vibration, super clean clothes."
5.0,"""Love my Washer!""","Having had an older Whirlpool Duet, I was hesitant to buy another front loader because the old washer had been a problem from the minute we bought it. I have had my Samsung for about 4 months and I am in love with it. The only thing I miss is the Whites cycle, although the steam cycle is similar."
5.0,"""Very Quiet""",This is my second Samsung washing machine that we have purchased and it is even quieter that the first one we bought for my inlaws.
4.0,"""Good value""","We purchased our Samsung washer and dryer on mid apr 2016. Delivery and installation was on time. Products work very good, just as expected. Some condensation accumulates on the plastic of the front door, so we leave the door open after finishing washing to let it evaporate."
5.0,"""Just what I was looking for!""","Awesome!!! l LOVE IT! Easy to install, had every option I needed. I would buy more appliances from Samsung."
5.0,"""great price for a great product""","With another kid on the way, we needed something that would last and I do believe that we found what we were looking for. Very nice looking, love the color. So much more quiet then our previous one."
5.0,"""Great for any laundry""","This washer doesn't have all the bells and whistles that the higher end models have, but it's more than capable enough for your everyday laundry needs. It seems well built too."
4.0,"""Nice design, easy to use""",I learned how to use my new washer in only 5 minutes! Very intuitive design and great look.
5.0,"""NICE WASHER""",GREAT WASHER I JUST WISH I WOULD BE ABLE TO CONNECT WITH SMART PHONE.
5.0,"""Love it!""","Quiet, holds a lot and it Sanitizes!!!! I love how I can fit king size bedding and it doesn't get damaged!"
5.0,"""Great washing machine!""",Very pleased so far. Quietly washed my queen size comforter and sheets with room to spare.
5.0,"""Front load washer""",I love this washer! Cant wait to see how everything else washes in it. Just got it so haven't washed everything. Love the looks. Love the performance so far.
4.0,"""Sleek and a super washer!""","It has what I call ""Super spin"" when finishing! Clothes were almost dry when done which me shorter dryer times and less energy used. Only problem is on the spin cycle it almost ""walked"" out of storage area. Will have to figure out how to prevent this.. Lots of options including a steam cycle. This front end loader makes it much easier since I am in a when chair..Most of the products in my Apt. now are Samsung!"
5.0,"""Great!""",Best washer I ever bought! Just make sure it level. [This review was collected as part of a promotion.]
5.0,"""Ease of use and varitey of cycle choices""","Immediately proceeding this purchase, we owned a different brand of front load washer. This Samsung is a slick model. It is easy to use and has many steam cycles to choose from. We like the My Cycle that we chose to use as our frequent ""go to"". Our last set was plain white, while this one is silver platinum. It is classy looking and is very quiet. It spins the clothes our to the point where the dryer doesn't take long to do it's work. We priced a lot of machines and this one was a good value during Memorial Day Sale at Best Buy."
5.0,"""Excellent!""",this product is so beautiful and excellent. I will recommend this to the others.
5.0,"""Great Washer at a great value""",I really love my new Samsung washer. It's energy efficient but still effective.
5.0,"""Samsung Front Loader""","This Samsung washer is an excellent unit. It is extremely quite and reliable. I have model 42H5200AW and it offers a sanitize, allergen, and steam cycles that are amazing. I would recommend this model to any friend or family member. Thumbs up to Samsung for this one!"
5.0,"""Excellent Washer!""",This washer is wonderful! It's much quieter than my older model which is nice because my laundry room is open to my kitchen. It sets the water temperature itself which is nice and there are many different cycles to choose from for various types of laundry. I've never minded doing laundry in the past but it's going to be even easier now!
5.0,"""Wow is all I can say""",I love the color and washes clothes better than any washer I have used before.
4.0,"""I love the front load washer over the top load. It's features makes it easier to see, load & put in the soap & other liquids.""","I need to call the installers back out because the washer vibrates when spinning. The front load washer has it over the top loader; it is easier to see just how much you are putting in. This makes it much easier not too over load. The washer is always showed with the draw but be careful, it comes with a high price tag."
5.0,"""Lots of Options""",This machine has all of the options one needs. It does a great job cleaning and is relatively quiet. Would recommend purchase.
5.0,"""Best washer ever!""",Best washer ever owned and nice designas well.Thanks Samsung
5.0,"""Awesome washer""",A huge improvement over our old machine. Quiet and impressive cleaning performance.
5.0,"""Great Features at a value price""",Best front load I have owned. Super hot wash with sanitize cycle is the best. [This review was collected as part of a promotion.]
5.0,"""Wonderful""","Great value, user friendly, wonderful product, the only problem is that the web site freezes during registration."
5.0,"""controls""",very easy to see the controls and I enjoy the little jiggle when it goes off
5.0,"""Love this Washer""",This is my third Front Loader washer and this is my favorite. It remembers the last load settings and automatically shuts off when it is done.
5.0,"""Beautiful Set""",I have them on Pedestals and they look gorgeous and BIG!
5.0,"""Gets clothes clean""",We ordered this washer as part of a set. Still haven't used all the features but can vouch for the sanitizing feature which not only thoroughly disinfects clothes but also helps to neutralize some pretty egregious pet odors. Simple to use with enough bells and whistles to please all but the most hard core technophile (you can only run diagnostics on your phone - not operate the appliance).
4.0,"""Real Nice Steam Washer""",Just purchased unit and already ran 4 loads through it seamlessly. Only problem was the door latch had not been tightened. Nothing a screwdriver could not fix (after confirming with customer support the latch it supposed to be tight). This is my first Samsung appliance. Hope is lasts longer than the LG steam washer it replaced (12yrs on that one)
5.0,"""I LOVE MY NEW WASHER""",I just purchased a new set and I am so very pleased. I had my last set for 8 years and I look forward to having this set 8 years or more. The style is exquisite and the color and finish is so beautiful. I shared my new set with friends and neighbors and they agree that it is beautiful and a great value. It runs so quietly and efficiently. I am truly happy and excited with my purchases. Thank you Samsung for good quality and value.
5.0,"""Great washer""",Quick and efficient. It does a great job and is very quiet.
5.0,,There is no review to accompany this rating.
5.0,"""Excellent Washing Machine""","I purchased this unit a week ago and so far it has done an excellent job. The quietness of this model is superb. It's the quietest washing machine I have ever heard and does an excellent job cleaning, especially whites on the sanitize function. I would highly recommend this product."
5.0,,There is no review to accompany this rating.
5.0,"""Front Load Washers...""","With the advent of high efficiency washers and the elimination of the agitator on top load washers, front load is the only way to go.The tumbling action accomplishes what the agitator would have done.Front load washers with no agitators have been used in Europe for a very long time with success."
5.0,"""Great Washer""","Love the washer, its got tons of options and is very quite..."
5.0,"""Great Washer""",Just replaced a samsung washer we had for 10 years. We loved it so much we had to have another samsung washer.
1.0,"""Loud and Unbalanced""","Several attempts made to ""balance"" but it's still ridiculously loud! It's the drum --- bad design!"
5.0,"""Front Load Washer WF5200 4.2 cu ft""",Works like a gem. I love it. I like the wash & spin selections. Clothes come out with right amount of dampness that doesn't take forever to dry.
5.0,"""Sweet Machine!""","Just like the matching dryer - this is an absolutely beautiful machine. Capacity is large, so I can save energy by washing bigger loads - and it saves me time too! I had a little glitch with the door latch after about 6 months, but the support team responded professionally and kindly - getting me a warranty covered service call scheduled immediately, and my machine was back in service the next day. That's amazing!"
5.0,"""Great""","I love it, easy to use and keeps my clothes very clean"
5.0,"""Love this washer""",I'm so glad I did not listen to all the negative things that my old school family said about front load washers because this washer is the best and i'm not sure how I washed clothes in the past without having one.
5.0,"""Simply amazing""",I don't know how I washed before. This washer is excellent!
5.0,"""Great value for money""",Love the steam feature and the allergen and sanitize cycles. Quiet as a whisper.
5.0,"""So many options!""",Loving this washer! There are so many great features and it's so easy to use!
5.0,"""Love it""",Just got my new washer installed today after 15 year old washing machine gave out. Love the ability to program my own wash style in and keep it as a setting. Much quieter than previous old top load washer.
5.0,"""Love this product""",Bought this machine only a year after we bought another top loading machine. We were very unhappy with the top load. This machine gets our clothes very clean and the come out smelling fresh and not wrinkled.
4.0,"""Worth the purchase!""","Easy to assemble and use with standard features and no complaints other than at times when the washer is spinning the load it gets a little too loud and the vibration tends to move our machine around and out of position, however, I think it could easily be address when we figure out how to level it out. Overall, the product is wonderful."
5.0,"""Awesome machine""",Just recieved my washer and already in love with it.
5.0,"""Overall great machine""","Quite, throughly washes, wonderful features and love the design"
5.0,"""Love this product""",This is probably the best washer I've owned. It's really quiet and has tons of features.
4.0,"""My new wahser and dryer seem excellent.""","I am looking forward to using my new Samsung washer and dryer, I have only used them a few times and their performance was adequate. I was specially attracted to the platinum color and curved faced of the models."
5.0,"""Samsung Has been a great brand products""","I have always preferred by Samsung innovation and durability, easy to install"
4.0,"""Great Features""",I love the tones this plays at the end of the wash. Just a little happy feature to make everyday chores enjoyable.
4.0,"""Leaked water after 5 or 6 loads""",The new washer ran great and still does but on the 5th or 6th load we heard water shoot out the back of the washer. We found that there is a vent on the back up top and that is where water came out. We called NFM and they are sending another unit. I read online that this is a common occurrence on several front load manufacturers. They say to much soap can cause an overflow. I also read that if sometimes the water does not completely drain before spin that the pressure can cause it to come out of vent. Have done 2 more loads since then and it has not happened again. Still a bit of disappointment that they have not included this in possible issues in literature..
5.0,"""Excellent Washer""","Leave my clothes very clean, good size, I can wash my comforters and bath carpets without any problem. I love to use quick washer mode, save a lot of energy. It let you know that the clothes is ready with music."
5.0,"""Love this washer!!""","I've had a chance to use this washer several times already and I just love it. I've been using the quick wash, which takes much less time and really cleans the clothes. Quiet washer, which is a plus to the one I had before."
